user_input,faithfulness,answer_correctness,answer_relevancy,context_precision,context_recall,context_entity_recall,semantic_similarity
"What are the key features and materials used in the construction of the Quilted 10"" Thinsulate Insulated Boots, and where are they made?",0.35555555555555557,0.9318181818181817,0.31893913648607536,0.9999999999,0.3,0.19444444396990743,0.9999999999999997
"What are the key features and specifications of the Portable Utility Carrier, including its dimensions, materials, and additional functionalities?",0.16666666666666666,1.0,0.6482539397571342,0.0,0.0,0.09523809510204083,1.0000000000000002
"What are the key features of the Aurora Shield Polarized Sunglasses as described in the document, and what benefits do these features provide for the user?",0.35978835978835977,1.0,0.9490762563399575,0.6666666666,0.0,0.10900673388595018,1.0
"What are the key features of the Women's Day Adventurer Backpack, and how does its design cater specifically to women's needs?",0.19999999999999998,1.0,0.6456459874154303,0.6666666666,0.16666666666666666,0.13333333306666667,0.9999999999999999
"What insulation technology is used in the CozyLoft Heated Hoodie, and what are the temperature comfort ratings for light and moderate activities?",0.0,0.9999999373250693,0.6536510936715009,0.0,0.06666666666666667,0.09523809510204083,1.0000000000000002
